<?xml version="1.0" encoding="UTF-8"?>
<!DOCTYPE beans PUBLIC  "-//SPRING//DTD BEAN//EN" "http://www.springframework.org/dtd/spring-beans.dtd">

<!--
	Test that inner bean for target means that we can use
	autowire without ambiguity from target and proxy.
	$Id: innerBeanTarget.xml,v 1.1 2004-06-18 10:56:54 johnsonr Exp $
-->

<beans>

	<bean id="nopInterceptor" class="org.springframework.aop.interceptor.NopInterceptor">
	</bean>
	
	<bean id="testBean"
		class="org.springframework.aop.framework.ProxyFactoryBean"
	> 
			<property name="target">
				<bean class="org.springframework.beans.TestBean">	
					<property name="name"><value>innerBeanTarget</value></property>
				</bean>
			</property>
			
			<property name="interceptorNames">
				<value>nopInterceptor</value>
			</property>
	</bean>
	
	<!--	
		Autowire would fail if distinct target and proxy:
		we expect just to have proxy
	-->
	<bean id="autowireCheck" 
		class="org.springframework.aop.framework.ProxyFactoryBeanTests$DependsOnITestBean"
			autowire="constructor" />
	
</beans>		
	
	