<?xml version="1.0" encoding="UTF-8"?>
<!DOCTYPE beans PUBLIC  "-//SPRING//DTD BEAN//EN" "http://www.springframework.org/dtd/spring-beans.dtd">

<!--
	Tests for independent prototype behaviour.
-->

<beans>

	<!-- Simple target -->
	<bean id="test" class="org.springframework.aop.interceptor.SideEffectBean">	
		<property name="count"><value>10</value></property>
	</bean>
	
	
	<bean id="prototypeTarget" class="org.springframework.aop.interceptor.SideEffectBean" 
		singleton="false">	
		<property name="count"><value>10</value></property>
	</bean>
	
	
	
	
	<bean id="debugInterceptor" class="org.springframework.aop.interceptor.NopInterceptor">
	</bean>
	
	<bean id="singleton" 
			class="org.springframework.aop.framework.ProxyFactoryBean"
	>	
		<property name="interceptorNames"><value>debugInterceptor,test</value></property>		
		
	</bean>
	

	<bean id="prototype"
		class="org.springframework.aop.framework.ProxyFactoryBean"> 
		<property name="interceptorNames"><value>debugInterceptor,prototypeTarget</value></property>
		<property name="singleton"><value>false</value></property>
	</bean>
	
	<bean id="cglibPrototype"
		class="org.springframework.aop.framework.ProxyFactoryBean"> 
		<property name="interceptorNames"><value>debugInterceptor,prototypeTarget</value></property>
		<property name="singleton"><value>false</value></property>
		
		<!-- Force the use of CGLIB -->
		<property name="proxyTargetClass"><value>true</value></property>

	</bean>
	

</beans>		
	
	