<?xml version="1.0" encoding="UTF-8"?>
<!DOCTYPE beans PUBLIC  "-//SPRING//DTD BEAN//EN" "http://www.springframework.org/dtd/spring-beans.dtd">

<!--
	Common bean definitions for EnterpriseServices
	tests.
-->
<beans>

	<bean id="autoproxy"
		class="org.springframework.aop.framework.autoproxy.DefaultAdvisorAutoProxyCreator">
		<property name="customTargetSourceCreators">
			<list>
				<ref local="autoproxy.poolingTargetSourceCreator" />
				<ref local="autoproxy.prototypeTargetSourceCreator" />
			</list>
		</property>
	</bean>
	
	<bean id="autoproxy.poolingTargetSourceCreator"
		class="org.springframework.aop.framework.autoproxy.TestPoolingTargetSourceCreator">
	</bean>
	
	<bean id="autoproxy.prototypeTargetSourceCreator"
		class="org.springframework.aop.framework.autoproxy.SelectivePrototypeTargetSourceCreator">
	</bean>


	<bean id="test" singleton="false"
		class="org.springframework.beans.TestBean">
		<property name="name"><value>Rod</value></property>
		<property name="spouse"><ref local="wife"/></property>
	</bean>
	
	<!-- Prefix will prompt pooling -->
	<bean id="poolingTest" singleton="false"
		class="org.springframework.beans.TestBean">
		<property name="name"><value>Rod</value></property>
		<property name="spouse"><ref local="wife"/></property>
	</bean>
	
	<!-- Prefix will prompt prototype -->
	<bean id="prototypeTest" singleton="false"
		class="org.springframework.beans.TestBean">
		<property name="name"><value>Rod</value></property>
		<property name="spouse"><ref local="wife"/></property>
	</bean>
	
	<bean id="wife"
		class="org.springframework.beans.TestBean">
		<property name="name"><value>Kerry</value></property>
	</bean>
	

</beans>		
	
	