<?xml version="1.0" encoding="UTF-8"?>
<!DOCTYPE beans PUBLIC  "-//SPRING//DTD BEAN//EN" "http://www.springframework.org/dtd/spring-beans.dtd">

<!--
	Tests for independent prototype behaviour.
-->

<beans>

	<!-- Simple target -->
	<bean id="target" class="org.springframework.beans.TestBean">	
		<!-- initial value :-) -->
		<property name="name"><value>Adam</value></property>
	</bean>
	
	<bean id="nopInterceptor" class="org.springframework.aop.interceptor.NopInterceptor">
	</bean>
	
	<bean id="countingBeforeAdvice"
		class="org.springframework.aop.framework.CountingBeforeAdvice"
	/>
	
	<!--
		Note that there's normally no reason to create objects of this type
		in a BeanFactory. If for some strange reason you want to, use Type 3 IoC.
	-->
	<bean id="targetSource" class="org.springframework.aop.target.SingletonTargetSource">
		<constructor-arg><ref local="target"/></constructor-arg>
	</bean>

	<bean id="directTarget"
		class="org.springframework.aop.framework.ProxyFactoryBean"> 
		<property name="interceptorNames"><value>countingBeforeAdvice,nopInterceptor,target</value></property>
	</bean>
	
	<bean id="viaTargetSource"
		class="org.springframework.aop.framework.ProxyFactoryBean"> 
		<property name="interceptorNames"><value>nopInterceptor,targetSource</value></property>
	</bean>
	
	<bean id ="unsupportedInterceptor"
		class="org.springframework.aop.framework.UnsupportedInterceptor"
	/>
	
	<!--
		No target or target source, just the interceptor
	-->
	<bean id="noTarget"
		class="org.springframework.aop.framework.ProxyFactoryBean"> 
		<property name="proxyInterfaces"><value>org.springframework.beans.ITestBean</value></property>
		<property name="interceptorNames"><value>nopInterceptor,unsupportedInterceptor</value></property>
	</bean>

</beans>		
	
	