<?xml version="1.0" encoding="UTF-8"?>
<!DOCTYPE beans PUBLIC "-//SPRING//DTD BEAN//EN" "http://www.springframework.org/dtd/spring-beans.dtd">

<!--
  - Scheduler context for Quartz. Schedules "list images" and "check images" jobs.
  - Note that Quartz Jobs are throwaway objects, in contrast to shared TimerTasks.
	-->
<beans>

	<!-- Quartz Scheduler, with pre-registered triggers -->
	<!-- Will automatically start scheduling on context startup -->
	<bean id="scheduler" class="org.springframework.scheduling.quartz.SchedulerFactoryBean">
		<property name="triggers">
			<list>
				<ref local="listImagesTrigger"/>
				<ref local="checkImagesTrigger"/>
			</list>
		</property>
	</bean>

	<!-- Job definition for ListImagesQuartzJob -->
	<!-- Lists the images in the image database and sends a corresponding mail -->
	<bean id="listImagesJobDetail" class="org.springframework.scheduling.quartz.JobDetailBean">
		<property name="jobClass">
			<value>org.springframework.samples.imagedb.scheduling.ListImagesQuartzJob</value>
		</property>
		<property name="jobDataAsMap">
			<map>
				<entry key="imageDatabase"><ref bean="imageDatabase"/></entry>
				<entry key="mailSender"><ref bean="mailSender"/></entry>
				<entry key="mailFrom"><value>${mail.from}</value></entry>
				<entry key="mailTo"><value>${mail.to}</value></entry>
			</map>
		</property>
	</bean>

	<!-- Trigger for the job defined above -->
	<!-- Registered by the 'scheduler' bean -->
	<bean id="listImagesTrigger" class="org.springframework.scheduling.quartz.SimpleTriggerBean">
		<property name="jobDetail"><ref bean="listImagesJobDetail"/></property>
		<property name="startDelay"><value>10000</value></property>
		<property name="repeatInterval"><value>10000</value></property>
	</bean>

	<!-- Job definition that delegates to the specified 'imageDatabase' method -->
	<!-- Convenient way of invoking existing business logic instead of writing a job -->
	<bean id="checkImagesJobDetail" class="org.springframework.scheduling.quartz.MethodInvokingJobDetailFactoryBean">
		<property name="targetObject"><ref bean="imageDatabase"/></property>
		<property name="targetMethod"><value>checkImages</value></property>
	</bean>

	<!-- Trigger for the job defined above -->
	<!-- Registered by the 'scheduler' bean -->
	<bean id="checkImagesTrigger" class="org.springframework.scheduling.quartz.CronTriggerBean">
		<property name="jobDetail"><ref bean="checkImagesJobDetail"/></property>
		<property name="cronExpression"><value>0/5 * * * * ?</value></property>
	</bean>

</beans>
