<?xml version="1.0" encoding="UTF-8"?>
<!DOCTYPE beans PUBLIC  "-//SPRING//DTD BEAN//EN" "http://www.springframework.org/dtd/spring-beans.dtd">

<beans>

	<!-- Simple target -->
	<bean id="test" class="org.springframework.beans.TestBean">	
		<property name="name"><value>custom</value></property>
		<property name="age"><value>666</value></property>
	</bean>
	

	
	<bean id="debugInterceptor" class="org.springframework.aop.interceptor.NopInterceptor">
	</bean>
	
	<bean id="test1" 
			class="org.springframework.aop.framework.ProxyFactoryBean"
	>	
		<property name="proxyInterfaces"><value>org.springframework.beans.ITestBean</value></property>		
		
		<property name="target"><ref local="test"/></property>	
		<property name="interceptorNames"><value>debugInterceptor</value></property>		
		
	</bean>
	
	<!--
		Check that invoker is automatically added to wrap target.
		Non pointcut bean name should be wrapped in invoker.
	-->
	<bean id="autoInvoker" 
			class="org.springframework.aop.framework.ProxyFactoryBean"
	>	
		<!-- 
			Aspect interfaces don't need to be included here.
			They may, for example, be added by global interceptors.
		 -->
		<property name="proxyInterfaces"><value>org.springframework.beans.ITestBean</value></property>		
		
		<!--
			Note that "test" is a target. An InvokerInterceptor
			will be added automatically.
		-->
		<property name="interceptorNames"><value>global*,test</value></property>
		
	</bean>
	
	<bean id="prototype" 
			class="org.springframework.aop.framework.ProxyFactoryBean"
	>	
		<property name="proxyInterfaces"><value>org.springframework.beans.ITestBean</value></property>		
		
		<property name="singleton"><value>false</value></property>
		
		<property name="interceptorNames"><value>test</value></property>		
		
	</bean>
	
	<bean id="test2" 
			class="org.springframework.aop.framework.ProxyFactoryBean"
	>	
		<property name="proxyInterfaces"><value>org.springframework.beans.ITestBean</value></property>		
		
		<property name="singleton"><value>false</value></property>
		
		<property name="interceptorNames"><value>test</value></property>		
		
	</bean>
	
	<bean id="pointcuts" 
			class="org.springframework.aop.framework.ProxyFactoryBean"
	>	
		<property name="proxyInterfaces"><value>org.springframework.beans.ITestBean</value></property>		
		
		<property name="interceptorNames"><value>pointcutForVoid,test</value></property>		
		
	</bean>
	
	<bean id="pointcutForVoid"
		class="org.springframework.aop.framework.ProxyFactoryBeanTests$PointcutForVoid"
	>
	</bean>
	
	<!--
		Invalid test for global pointcuts.
		Must have target because there are no interceptors.
	-->
	<!--
	<bean id="noInterceptorNamesWithoutTarget" 
			class="org.springframework.aop.framework.ProxyFactoryBean"
	>	
		<property name="proxyInterfaces"><value>org.springframework.beans.ITestBean</value></property>			
		
	</bean>
	
	<bean id="noInterceptorNamesWithTarget" 
			class="org.springframework.aop.framework.ProxyFactoryBean"
	>	
		<property name="proxyInterfaces"><value>org.springframework.beans.ITestBean</value></property>	
		<property name="target"><ref local="test"/></property>					
		
	</bean>
	-->
	
	<!-- Same effect as noInterceptor names: also invalid -->
	<bean id="emptyInterceptorNames" 
			class="org.springframework.aop.framework.ProxyFactoryBean"
	>	
		<property name="proxyInterfaces"><value>org.springframework.beans.ITestBean</value></property>			
		<property name="interceptorNames"><value> </value></property>
	</bean>
	
	<!--
		Invalid test for global pointcuts.
		Must have target after *.
	-->
	<bean id="globalsWithoutTarget" 
			class="org.springframework.aop.framework.ProxyFactoryBean"
	>	
		<property name="proxyInterfaces"><value>org.springframework.beans.ITestBean</value></property>			
		<property name="interceptorNames"><value>global*</value></property>
	</bean>
	
	
	<bean id="validGlobals" 
			singleton="true"
			class="org.springframework.aop.framework.ProxyFactoryBean"
	>	
		<property name="proxyInterfaces"><value>org.springframework.context.ApplicationListener</value></property>			
		<property name="interceptorNames"><value>debugInterceptor,global*,target2</value></property>
	</bean>
	
	<!--
		Global debug interceptor
	-->
	<bean id="global_debug"
		class="org.springframework.aop.interceptor.DebugInterceptor">
	</bean>
	
	<!--
		Will add aspect interface to all beans exposing globals
	-->
	<bean id="global_aspectInterface"
		class="org.springframework.aop.framework.ProxyFactoryBeanTests$GlobalIntroductionAdvice">
	</bean>
	
	<bean id="target2"
		class="org.springframework.context.event.ConsoleListener">
	</bean>
	
	<bean id="prototypeLockMixinAdvisor" class="org.springframework.aop.framework.LockMixinAdvisor" singleton="false"/>

	<bean id="prototypeTestBean" class="org.springframework.beans.TestBean" singleton="false"/>

	<bean id="prototypeTestBeanProxy" class="org.springframework.aop.framework.ProxyFactoryBean">
		<property name="proxyInterfaces"><value>org.springframework.beans.ITestBean</value></property>
		<property name="singleton"><value>false</value></property>
		<property name="interceptorNames">
			<list>
				<value>prototypeLockMixinAdvisor</value>
				<value>prototypeTestBean</value>
			</list>
		</property>
	</bean>

	<bean id="prototypeLockMixinInterceptor" class="org.springframework.aop.framework.LockMixin" singleton="false"/>

	<bean id="prototypeTestBeanProxySingletonTarget" class="org.springframework.aop.framework.ProxyFactoryBean">
		<property name="proxyInterfaces">
			<list>
				<value>org.springframework.beans.ITestBean</value>
				<value>org.springframework.aop.framework.Lockable</value>
			</list>
		</property>
		<property name="singleton"><value>false</value></property>
		<property name="target"><ref local="prototypeTestBean"/></property>
		<property name="interceptorNames">
			<list>
				<value>prototypeLockMixinInterceptor</value>
			</list>
		</property>
	</bean>

</beans>
