<?xml version="1.0" encoding="UTF-8"?>
<!DOCTYPE beans PUBLIC  "-//SPRING//DTD BEAN//EN" "http://www.springframework.org/dtd/spring-beans.dtd">

<beans>

	<bean name="assemblerOne" class="org.springframework.transaction.interceptor.TransactionProxyFactoryBean">
		<property name="transactionManager"><ref bean="transactionManager"/></property>
		<property name="target"><ref parent="assemblerOne"/></property>
		<property name="proxyTargetClass"><value>true</value></property>
		<property name="transactionAttributes">
			<props>
				<prop key="test">PROPAGATION_REQUIRED</prop>
			</props>
		</property>
	</bean>

	<bean name="assemblerTwo" class="org.springframework.transaction.interceptor.TransactionProxyFactoryBean">
		<property name="transactionManager"><ref bean="transactionManager"/></property>
		<property name="target"><ref parent="assemblerTwo"/></property>
		<property name="proxyTargetClass"><value>true</value></property>
		<property name="transactionAttributes">
			<props>
				<prop key="test">PROPAGATION_REQUIRED</prop>
			</props>
		</property>
	</bean>

</beans>
