<?xml version="1.0" encoding="UTF-8"?>
<!DOCTYPE beans PUBLIC  "-//SPRING//DTD BEAN//EN" "http://www.springframework.org/dtd/spring-beans.dtd">

<beans>

	<bean id="defaultAttributeRegistry" class="org.springframework.aop.attributes.MapAttributeRegistry">	
	
	</bean>
	
	
	<bean id="demoController"
		 class="org.springframework.web.servlet.mvc.DemoController">	
	
	</bean>
	
	<!-- Overridden by next factory -->
	<bean id="test" class="org.springframework.beans.TestBean">	
		<property name="name"><value>custom</value></property>
		<property name="age"><value>25</value></property>
	</bean>

</beans>		
	
	