<?xml version="1.0" encoding="UTF-8"?>
<!DOCTYPE beans PUBLIC "-//SPRING//DTD BEAN//EN" "http://www.springframework.org/dtd/spring-beans.dtd">

<!--
  - Application context definition for PetClinic on JDBC.
  -->
<beans>

	<!-- ========================= RESOURCE DEFINITIONS ========================= -->
  
	<!-- Configurer that replaces ${...} placeholders with values from a properties file -->
	<!-- (in this case, JDBC-related settings for the dataSource definition below) -->
	<bean id="propertyConfigurer" class="org.springframework.beans.factory.config.PropertyPlaceholderConfigurer">
		<property name="location" value="/WEB-INF/jdbc.properties"/>
	</bean>

	<!-- 
		Simple local DataSource that works in any environment.
		This uses the JDBC DriverManager to obtain connections, and does NOT perform connection
		pooling. Connection pooling is essential to all real-world applications.
		This definition is good for getting started, as it introduces no dependencies beyond
		the JDK, but DriverManagerDataSource is not intended for production usage.
	 -->
	<bean id="dataSource" class="org.springframework.jdbc.datasource.DriverManagerDataSource">
		<property name="driverClassName" value="${jdbc.driverClassName}"/>
		<property name="url" value="${jdbc.url}"/>
		<property name="username" value="${jdbc.username}"/>
		<property name="password" value="${jdbc.password}"/>
	</bean>
	
	<!-- 
		Alternative local DataSource that works in any environment, and offers much better performance.
		Uses Apache Commons DBCP for connection pooling. See Commons DBCP documentation
		for the required JAR files. See the PetStore sample application also shipped with
		Spring, for an example of Commons DBCP usage and the necessary build script.
		Alternatively you can use another connection pool such as C3P0, similarly configured
		using Spring.
		A standalone connection pool such as Commons DBCP is a good choice for use outside an
		application server environment, including web applications running in a web container without
		JTA, or integration testing using the org.springframework.test package.
	 -->
	<!--
	<bean id="dataSource" class="org.apache.commons.dbcp.BasicDataSource" destroy-method="close">
		<property name="driverClassName" value="${jdbc.driverClassName}"/>
		<property name="url" value="${jdbc.url}"/>
		<property name="username" value="${jdbc.username}"/>
		<property name="password" value="${jdbc.password}"/>
	</bean>
	-->

	<!-- JNDI DataSource for J2EE environments -->
	<!--
	<bean id="dataSource" class="org.springframework.jndi.JndiObjectFactoryBean">
		<property name="jndiName" value="java:comp/env/jdbc/petclinic"/>
	</bean>
	-->

	<!-- Transaction manager for a single JDBC DataSource (alternative to JTA) -->
	<bean id="transactionManager" class="org.springframework.jdbc.datasource.DataSourceTransactionManager">
		<property name="dataSource" ref="dataSource"/>
	</bean>

	<!-- Transaction manager that delegates to JTA (for a transactional JNDI DataSource) -->
	<!--
	<bean id="transactionManager" class="org.springframework.transaction.jta.JtaTransactionManager"/>
	-->


	<!-- ========================= BUSINESS OBJECT DEFINITIONS ========================= -->

	<!-- PetClinic's central data access object: HSQL JDBC implementation -->
	<!-- (only initialized when referenced by the "clinic" proxy) -->
	<bean id="hsqlClinic" class="org.springframework.samples.petclinic.jdbc.HsqlJdbcClinic" lazy-init="true">
		<property name="dataSource" ref="dataSource"/>
	</bean>

	<!-- PetClinic's central data access object: MySQL JDBC implementation -->
	<!-- (only initialized when referenced by the "clinic" proxy) -->
	<bean id="mysqlClinic" class="org.springframework.samples.petclinic.jdbc.MySQLJdbcClinic" lazy-init="true">
		<property name="dataSource" ref="dataSource"/>
	</bean>

	<!--
		- Transactional proxy for PetClinic's central data access facade.
		- Implements the CachingClinic management interface.
		-
		- Note that in a real-life app with multiple transaction proxies,
		- you will probably want to use parent and child bean definitions
		- as described in the manual, to reduce duplication.
    -->
	<bean id="clinic" class="org.springframework.transaction.interceptor.TransactionProxyFactoryBean">
		<property name="transactionManager" ref="transactionManager"/>
		<property name="target" ref="${petclinic.jdbcImplBeanName}"/>
		<property name="transactionAttributes">
			<props>
				<prop key="*">PROPAGATION_REQUIRED</prop>
			</props>
		</property>
		<property name="preInterceptors" ref="callMonitor"/>
	</bean>

	<!-- Call monitoring interceptor that monitors call count and call invocation time -->
	<!-- Implements the CallMonitor management interface -->
	<bean id="callMonitor" class="org.springframework.samples.petclinic.jmx.CallMonitoringInterceptor"/>


	<!-- ========================= JMX EXPORTER DEFINITION ========================= -->

	<!--
	  - Exporter that exposes both the CachingClinic and the CallMonitor via JMX.
		-
		- By default, the standard MBeanServerFactory.findMBeanServer method will be used
		- to determine the MBeanServer. Unfortunately, this does not work on WebLogic <= 8.1:
		- you need to comment in the WebLogicMBeanServerFactoryBean definition on WebLogic,
		- specifying appropriate configuration values there.
		-
		- Note that you need to comment in the "defaultCurrencyTimeLimit" value on JBoss 3.x.
    -->
	<bean id="jmxExporter" class="org.springframework.jmx.export.MBeanExporter">
		<property name="beans">
			<map>
				<entry key="petclinic:service=clinic" value-ref="clinic"/>
				<entry key="petclinic:service=callMonitor" value-ref="callMonitor"/>
			</map>
		</property>
		<property name="assembler">
			<bean class="org.springframework.jmx.export.assembler.InterfaceBasedMBeanInfoAssembler">
				<property name="interfaceMappings">
					<props>
						<prop key="petclinic:service=clinic">org.springframework.samples.petclinic.jdbc.CachingClinic</prop>
						<prop key="petclinic:service=callMonitor">org.springframework.samples.petclinic.jmx.CallMonitor</prop>
					</props>
				</property>
				<!-- Comment the following in on JBoss 3.x, which doesn't follow -->
				<!-- the JMX 1.2 recommendation for currencyTimeLimit behavior. -->
				<!--
				<property name="defaultCurrencyTimeLimit" value="0"/>
				-->
			</bean>
		</property>
		<!-- Comment the following in on WebLogic <= 8.1, which doesn't support -->
		<!-- the standard MBeanServerFactory.findMBeanServer lookup mechanism. -->
		<!--
		<property name="server">
			<bean class="org.springframework.jmx.support.WebLogicMBeanServerFactoryBean">
				<property name="username" value="weblogic"/>
				<property name="password" value="weblogic"/>
				<property name="serverUrl" value="t3://localhost:7001"/>
				<property name="serverName" value="server"/>
			</bean>
		</property>
		-->
	</bean>

</beans>
