<?xml version="1.0" encoding="UTF-8"?>
<!-- $Id: beans2.xml,v 1.1 2004-01-27 00:03:45 colins Exp $ -->
<!DOCTYPE beans PUBLIC "-//SPRING//DTD BEAN//EN" "http://www.springframework.org/dtd/spring-beans.dtd">

<beans>

  <bean id="beans2.bean1" class="org.springframework.beans.factory.access.TestBean">
    <property name="name"><value>beans2.bean1</value></property>
  </bean>

  <bean id="beans2.bean2" class="org.springframework.beans.factory.access.TestBean">
    <property name="name"><value>beans2.bean2</value></property>
    <property name="objRef"><ref bean="beans1.bean1"/></property>
  </bean>
 
</beans>
