<?xml version="1.0" encoding="UTF-8"?>
<!DOCTYPE beans PUBLIC  "-//SPRING//DTD BEAN//EN" "http://www.springframework.org/dtd/spring-beans.dtd">

<!--
	Common bean definitions for EnterpriseServices
	tests.
-->
<beans>

<bean id="enterpriseServices" 
		class="org.springframework.aop.framework.autoproxy.DefaultAdvisorAutoProxyCreator">
	
	<!-- Change default exclusion prefix -->
	<property name="usePrefix"><value>true</value></property>
	<property name="advisorBeanNamePrefix"><value>es.</value></property>
		
		<property name="customTargetSourceCreators">
			<list>
				<ref local="es.poolingTargetSourceCreator" />
				<ref local="es.prototypeTargetSourceCreator" />
				<ref local="es.threadLocalTargetSourceCreator" />
			</list>
		</property>
	</bean>
	
	<bean id="es.poolingTargetSourceCreator"
		class="org.springframework.aop.framework.autoproxy.metadata.AttributesPoolingTargetSourceCreator"
		autowire="constructor" >
	</bean>

	<bean id="es.txManager"
		class="org.springframework.transaction.CountingTxManager">
	</bean>
	
	<bean id="es.TAS"
		class="org.springframework.transaction.interceptor.AttributesTransactionAttributeSource"
		autowire="constructor">
	</bean>
	
	<bean id="es.txAdviceInterceptor"
		class="org.springframework.transaction.interceptor.TransactionInterceptor">
		<property name="transactionManager"> <ref bean="es.txManager"/></property>
		<property name="transactionAttributeSource"><ref bean="es.TAS"/></property>
	</bean>
	
	<bean id="es.txAdvice"
		class="org.springframework.transaction.interceptor.TransactionAttributeSourceAdvisor"
		autowire="constructor" >
	</bean>
	
	<bean id="es.prototypeTargetSourceCreator"
		class="org.springframework.aop.framework.autoproxy.metadata.AttributesPrototypeTargetSourceCreator"
		autowire="constructor" >
	</bean>
	
	<bean id="es.threadLocalTargetSourceCreator"
		class="org.springframework.aop.framework.autoproxy.metadata.AttributesThreadLocalTargetSourceCreator"
		autowire="constructor" >
	</bean>
	
	
	<bean id="txClass"
		class="org.springframework.aop.framework.autoproxy.metadata.TxClassImpl">
	</bean>
	
	<bean id="txClassWithClassAttribute" singleton="false"
		class="org.springframework.aop.framework.autoproxy.metadata.TxClassWithClassAttribute">
	</bean>
	
	<bean id="noProxy"
		class="org.springframework.beans.TestBean">
	</bean>
	
	
	
	<!--
		Must NOT be a singleton. Used in stateful introductions.
	-->
	<bean id="es.modifiableAdvice"
		class="org.springframework.aop.framework.autoproxy.metadata.ModifiableAdvisor"
		singleton="false"
	>
		<property name="attributes"><ref bean="attributes"/></property>
	</bean>
	
	<bean id="modifiable1"
		class="org.springframework.aop.framework.autoproxy.metadata.ModifiableTestBean" />

	
	<bean id="modifiable2"
		class="org.springframework.aop.framework.autoproxy.metadata.ModifiableTestBean" />
	
	
	<bean id="protoTest"
		class="org.springframework.aop.framework.autoproxy.metadata.PrototypeTestBean" 
		singleton="false">
	</bean>
	
	<bean id="threadLocalTest"
		class="org.springframework.aop.framework.autoproxy.metadata.ThreadLocalTestBean" 
		singleton="false">
	</bean>
	
	<!-- Should not be proxied -->
	<bean id="rawTest"
		singleton="false"
		class="org.springframework.beans.TestBean" >
	</bean>
	

</beans>		
	
	