<?xml version="1.0" encoding="UTF-8" ?>
<!DOCTYPE beans PUBLIC "-//SPRING//DTD BEAN//EN" "http://www.springframework.org/dtd/spring-beans.dtd">

<!--
  - DispatcherServlet application context for the Spring web MVC
	- implementation of JPetStore's web tier.
	-->
<beans>

	<!-- ========================= VIEW DEFINITIONS ========================= -->

	<bean id="viewResolver" class="org.springframework.web.servlet.view.InternalResourceViewResolver">
		<property name="viewClass"><value>org.springframework.web.servlet.view.JstlView</value></property>
		<property name="prefix"><value>/WEB-INF/jsp/spring/</value></property>
		<property name="suffix"><value>.jsp</value></property>
	</bean>


	<!-- ========================= DEFINITIONS OF PUBLIC CONTROLLERS ========================= -->

	<bean id="defaultHandlerMapping" class="org.springframework.web.servlet.handler.BeanNameUrlHandlerMapping"/>

	<bean name="/shop/addItemToCart.do" class="org.springframework.samples.jpetstore.web.spring.AddItemToCartController">
		<property name="petStore"><ref bean="petStore"/></property>
	</bean>

	<bean name="/shop/checkout.do" class="org.springframework.samples.jpetstore.web.spring.ViewCartController">
		<property name="successView"><value>Checkout</value></property>
	</bean>

	<bean name="/shop/index.do" class="org.springframework.web.servlet.mvc.ParameterizableViewController">
		<property name="viewName"><value>index</value></property>
	</bean>

	<bean name="/shop/newAccount.do" class="org.springframework.samples.jpetstore.web.spring.AccountFormController">
		<property name="petStore"><ref bean="petStore"/></property>
		<property name="validator"><ref bean="accountValidator"/></property>
		<property name="successView"><value>index</value></property>
	</bean>

	<bean name="/shop/removeItemFromCart.do" class="org.springframework.samples.jpetstore.web.spring.RemoveItemFromCartController"/>

	<bean name="/shop/signoff.do" class="org.springframework.samples.jpetstore.web.spring.SignoffController"/>

	<bean name="/shop/searchProducts.do" class="org.springframework.samples.jpetstore.web.spring.SearchProductsController">
		<property name="petStore"><ref bean="petStore"/></property>
	</bean>

	<bean name="/shop/signon.do" class="org.springframework.samples.jpetstore.web.spring.SignonController">
		<property name="petStore"><ref bean="petStore"/></property>
	</bean>

	<bean name="/shop/signonForm.do" class="org.springframework.web.servlet.mvc.ParameterizableViewController">
		<property name="viewName"><value>SignonForm</value></property>
	</bean>

	<bean name="/shop/updateCartQuantities.do" class="org.springframework.samples.jpetstore.web.spring.UpdateCartQuantitiesController"/>

	<bean name="/shop/viewCart.do" class="org.springframework.samples.jpetstore.web.spring.ViewCartController">
		<property name="successView"><value>Cart</value></property>
	</bean>

	<bean name="/shop/viewCategory.do" class="org.springframework.samples.jpetstore.web.spring.ViewCategoryController">
		<property name="petStore"><ref bean="petStore"/></property>
	</bean>

	<bean name="/shop/viewItem.do" class="org.springframework.samples.jpetstore.web.spring.ViewItemController">
		<property name="petStore"><ref bean="petStore"/></property>
	</bean>

	<bean name="/shop/viewProduct.do" class="org.springframework.samples.jpetstore.web.spring.ViewProductController">
		<property name="petStore"><ref bean="petStore"/></property>
	</bean>


	<!-- ========================= DEFINITIONS OF PROTECTED CONTROLLERS ========================= -->

	<bean id="secureHandlerMapping" class="org.springframework.web.servlet.handler.SimpleUrlHandlerMapping">
		<property name="interceptors">
			<list>
				<ref bean="signonInterceptor"/>
			</list>
		</property>
		<property name="urlMap">
			<map>
				<entry key="/shop/editAccount.do"><ref local="secure_editAccount"/></entry>
				<entry key="/shop/listOrders.do"><ref local="secure_listOrders"/></entry>
				<entry key="/shop/newOrder.do"><ref local="secure_newOrder"/></entry>
				<entry key="/shop/viewOrder.do"><ref local="secure_viewOrder"/></entry>
			</map>
		</property>
	</bean>

	<bean id="signonInterceptor" class="org.springframework.samples.jpetstore.web.spring.SignonInterceptor"/>

	<bean id="secure_editAccount" class="org.springframework.samples.jpetstore.web.spring.AccountFormController">
		<property name="petStore"><ref bean="petStore"/></property>
		<property name="validator"><ref bean="accountValidator"/></property>
		<property name="successView"><value>index</value></property>
	</bean>

	<bean id="secure_listOrders" class="org.springframework.samples.jpetstore.web.spring.ListOrdersController">
		<property name="petStore"><ref bean="petStore"/></property>
	</bean>

	<bean id="secure_newOrder" class="org.springframework.samples.jpetstore.web.spring.OrderFormController">
		<property name="petStore"><ref bean="petStore"/></property>
		<property name="validator"><ref bean="orderValidator"/></property>
	</bean>

	<bean id="secure_viewOrder" class="org.springframework.samples.jpetstore.web.spring.ViewOrderController">
		<property name="petStore"><ref bean="petStore"/></property>
	</bean>

</beans>
